{
  "$schema": "https://json-schema.org/draft/2020-12/schema",
  "type": "object",
  "required": ["reviewed", "policy", "sources", "denied"],
  "properties": {
    "reviewed": { "type": "string", "format": "date" },
    "policy": { "type": "string" },
    "sources": {
      "type": "array",
      "items": {
        "type": "object",
        "required": ["id", "repository", "owns"],
        "properties": {
          "id": { "type": "string" },
          "repository": { "type": "string" },
          "revision": { "type": "string", "pattern": "^[0-9a-f]{40}$" },
          "reviewed": { "type": "string", "format": "date" },
          "owns": { "type": "array", "items": { "type": "string" } }
        }
      }
    },
    "denied": { "type": "array", "items": { "type": "string" } }
  }
}
