{
  "$schema": "https://docs.mobazha.org/sources.schema.json",
  "reviewed": "2026-07-08",
  "policy": "Only reviewed public material from these owners may be curated into the public site.",
  "sources": [
    {
      "id": "community-backend",
      "repository": "https://github.com/mobazha/mobazha/tree/main",
      "revision": "b21ea986698aad3c1165dbdd8ac7d4acc7f2afba",
      "reviewed": "2026-07-08",
      "owns": [
        "backend",
        "deployment",
        "OpenAPI",
        "MCP",
        "webhooks",
        "extensions",
        "conformance",
        "release notes",
        "implementation evidence"
      ]
    },
    {
      "id": "public-client",
      "repository": "https://github.com/mobazha/mobazha-unified/tree/main",
      "revision": "a772284daabea38b042fefabf7b1ebc291921aaa",
      "reviewed": "2026-07-04",
      "owns": [
        "frontend implementation",
        "runtime capability client behavior",
        "frontend product composition",
        "feature and package design",
        "client release notes",
        "implementation evidence"
      ]
    },
    {
      "id": "public-website",
      "repository": "https://github.com/mobazha/mobazha.org",
      "revision": "6ed732955bd9ebfaefaef2d6ef69a1614e836029",
      "reviewed": "2026-07-04",
      "owns": [
        "public positioning",
        "current pricing",
        "hosted-service status",
        "legal and privacy policies",
        "website navigation"
      ]
    },
    {
      "id": "docs-curation",
      "repository": "this repository",
      "owns": [
        "canonical public knowledge",
        "project-wide policy",
        "user and operator guidance",
        "cross-repository explanations",
        "RFCs",
        "project ADRs",
        "public history",
        "machine-readable discovery"
      ]
    }
  ],
  "denied": [
    "credentials or recovery material",
    "customer or production data",
    "private incident and operational logs",
    "unapproved forecasts or commercial percentages",
    "internal-only Hosting plans, forecasts, and playbooks",
    "repositories that are not anonymously readable"
  ]
}
