{
  "$schema": "./sources.schema.json",
  "reviewed": "2026-07-04",
  "policy": "Only reviewed public material from these owners may be curated into the public site.",
  "sources": [
    {
      "id": "community-backend",
      "repository": "https://github.com/mobazha/mobazha/tree/main",
      "revision": "21bd6a5968991430bacfbd4a7449446a338fab0d",
      "reviewed": "2026-07-04",
      "owns": ["backend", "deployment", "OpenAPI", "MCP", "webhooks", "extensions", "release notes", "public project policy"]
    },
    {
      "id": "public-client",
      "repository": "https://github.com/mobazha/mobazha-unified/tree/main",
      "revision": "b1015e73409ebc617bd773e5de92fdd4a6deb151",
      "reviewed": "2026-07-04",
      "owns": ["buyer and seller experience", "frontend development", "runtime capability client behavior", "client release notes"]
    },
    {
      "id": "public-website",
      "repository": "https://github.com/mobazha/mobazha.org",
      "revision": "6ed732955bd9ebfaefaef2d6ef69a1614e836029",
      "reviewed": "2026-07-04",
      "owns": ["public positioning", "current pricing", "hosted-service status", "legal and privacy policies", "website navigation"]
    },
    {
      "id": "docs-curation",
      "repository": "this repository",
      "owns": ["information architecture", "derived guidance", "machine-readable discovery"]
    }
  ],
  "denied": [
    "credentials or recovery material",
    "customer or production data",
    "private incident and operational logs",
    "unapproved forecasts or commercial percentages",
    "internal-only Hosting plans, forecasts, and playbooks",
    "repositories that are not anonymously readable"
  ]
}
